root@lamp-s-1vcpu-1gb-tor1-01:~# tcpdump 
tcpdump: verbose output suppressed, use -v or -vv for full protocol decode
listening on eth0, link-type EN10MB (Ethernet), capture size 262144 bytes
18:12:02.387403 IP lamp-s-1vcpu-1gb-tor1-01.ssh > 198.96.85.163.59296: Flags [P.], seq 3708260300:3708260408, ack 4150740445, win 349, options [nop,nop,TS val 3312017422 ecr 2897331688], length 108
18:12:02.387552 IP lamp-s-1vcpu-1gb-tor1-01.ssh > 198.96.85.163.59296: Flags [P.], seq 108:144, ack 1, win 349, options [nop,nop,TS val 3312017422 ecr 2897331688], length 36
18:12:02.388945 IP lamp-s-1vcpu-1gb-tor1-01.ssh > 198.96.85.163.59296: Flags [P.], seq 144:252, ack 1, win 349, options [nop,nop,TS val 3312017424 ecr 2897331688], length 108
18:12:02.389037 IP lamp-s-1vcpu-1gb-tor1-01.ssh > 198.96.85.163.59296: Flags [P.], seq 252:288, ack 1, win 349, options [nop,nop,TS val 3312017424 ecr 2897331688], length 36
18:12:02.389713 IP 198.96.85.163.59296 > lamp-s-1vcpu-1gb-tor1-01.ssh: Flags [.], ack 108, win 501, options [nop,nop,TS val 2897331730 ecr 3312017422], length 0
18:12:02.389755 IP 198.96.85.163.59296 > lamp-s-1vcpu-1gb-tor1-01.ssh: Flags [.], ack 144, win 501, options [nop,nop,TS val 2897331730 ecr 3312017422], length 0
18:12:02.391232 IP 198.96.85.163.59296 > lamp-s-1vcpu-1gb-tor1-01.ssh: Flags [.], ack 252, win 501, options [nop,nop,TS val 2897331732 ecr 3312017424], length 0
18:12:02.444264 IP lamp-s-1vcpu-1gb-tor1-01.ssh > 198.96.85.163.59296: Flags [P.], seq 288:1540, ack 1, win 349, options [nop,nop,TS val 3312017479 ecr 2897331732], length 1252
18:12:02.444398 IP lamp-s-1vcpu-1gb-tor1-01.ssh > 198.96.85.163.59296: Flags [P.], seq 1540:1752, ack 1, win 349, options [nop,nop,TS val 3312017479 ecr 2897331732], length 212
18:12:02.444521 IP lamp-s-1vcpu-1gb-tor1-01.ssh > 198.96.85.163.59296: Flags [P.], seq 1752:1964, ack 1, win 349, options [nop,nop,TS val 3312017479 ecr 2897331732], length 212
18:12:02.444633 IP lamp-s-1vcpu-1gb-tor1-01.ssh > 198.96.85.163.59296: Flags [P.], seq 1964:2176, ack 1, win 349, options [nop,nop,TS val 3312017479 ecr 2897331732], length 212
18:12:02.444743 IP lamp-s-1vcpu-1gb-tor1-01.ssh > 198.96.85.163.59296: Flags [P.], seq 2176:2388, ack 1, win 349, options [nop,nop,TS val 3312017479 ecr 2897331732], length 212
18:12:02.444873 IP lamp-s-1vcpu-1gb-tor1-01.ssh > 198.96.85.163.59296: Flags [P.], seq 2388:2600, ack 1, win 349, options [nop,nop,TS val 3312017479 ecr 2897331732], length 212
18:12:02.445000 IP lamp-s-1vcpu-1gb-tor1-01.ssh > 198.96.85.163.59296: Flags [P.], seq 2600:2812, ack 1, win 349, options [nop,nop,TS val 3312017480 ecr 2897331732], length 212

