root@lamp-s-1vcpu-1gb-tor1-01:~# tcpdump -c 5 -i eth0
tcpdump: verbose output suppressed, use -v or -vv for full protocol decode
listening on eth0, link-type EN10MB (Ethernet), capture size 262144 bytes
18:13:28.423240 IP lamp-s-1vcpu-1gb-tor1-01.ssh > 198.96.85.163.59296: Flags [P.], seq 3712697716:3712697824, ack 4150746709, win 349, options [nop,nop,TS val 3312103459 ecr 2897417759], length 108
18:13:28.423402 IP lamp-s-1vcpu-1gb-tor1-01.ssh > 198.96.85.163.59296: Flags [P.], seq 108:144, ack 1, win 349, options [nop,nop,TS val 3312103459 ecr 2897417759], length 36
18:13:28.423569 IP lamp-s-1vcpu-1gb-tor1-01.ssh > 198.96.85.163.59296: Flags [P.], seq 144:252, ack 1, win 349, options [nop,nop,TS val 3312103459 ecr 2897417759], length 108
18:13:28.423673 IP lamp-s-1vcpu-1gb-tor1-01.ssh > 198.96.85.163.59296: Flags [P.], seq 252:288, ack 1, win 349, options [nop,nop,TS val 3312103459 ecr 2897417759], length 36
18:13:28.425613 IP 198.96.85.163.59296 > lamp-s-1vcpu-1gb-tor1-01.ssh: Flags [.], ack 108, win 696, options [nop,nop,TS val 2897417767 ecr 3312103459], length 0
5 packets captured
18 packets received by filter
7 packets dropped by kernel

